{
  "schema": "mcp_proof_snapshot.v1",
  "generated_at": "2025-11-21T18:19:33.921705Z",
  "components": {
    "e01_schema": {
      "ok": false,
      "present": true,
      "details": {
        "schema": {
          "exists": false,
          "error": null
        },
        "notes": [
          "mcp schema missing"
        ]
      }
    },
    "e02_ro_dsn": {
      "ok": true,
      "present": true,
      "details": {}
    },
    "e03_ingest": {
      "ok": false,
      "present": false,
      "details": {}
    },
    "e04_query": {
      "ok": true,
      "present": true,
      "details": {}
    }
  },
  "artifacts": [
    "evidence/guard_mcp_schema.json",
    "evidence/guard_mcp_db_ro.final.json",
    "evidence/guard_mcp_query.json"
  ],
  "overall_ok": false
}